{
  "version": 1,
  "generated_at": "2026-04-22T12:00:00Z",
  "generated_by": "Shredder",
  "pipeline_mode": "full",
  "planning_advisories": [
    {
      "id": "ISC-012",
      "severity": "high",
      "summary": "Firestore offline cache writes plaintext LevelDB on Android.",
      "decision": "Proceed with documented exception unless the user overrides.",
      "user_response_required": false,
      "references": ["ISC-012", "PRD-8.3", "ADR-006"],
      "affects_slices": ["L1-orders-001"]
    }
  ],
  "slices": [
    {
      "id": "L1-orders-001",
      "title": "Create order aggregate",
      "phase": "phase_1",
      "status": "pending",
      "author_agent": "Bebop",
      "layer": 1,
      "bounded_context": "orders",
      "target_loc": 300,
      "objective": "Create the initial order aggregate and its tests.",
      "context_to_update": "project_state.md",
      "implementation_details": [
        "Create an order aggregate root under src/orders.",
        "Persist aggregate tests under tests/orders.",
        "Keep the change bounded to order creation only."
      ],
      "review_required": true,
      "attempts": 0,
      "micro_corrections_used": 0,
      "depends_on": [],
      "adjacent_scope_allowed": [],
      "write_set": [
        "src/orders/**",
        "tests/orders/**"
      ],
      "traces_to": {
        "prd": [
          "[FR-001]"
        ],
        "adr": [
          "ADR-0001"
        ],
        "ddd": [
          "OrderAggregate"
        ],
        "isc": [
          "[ISC-001]"
        ],
        "dsd": [
          "[DSD-001]"
        ]
      },
      "verification_steps": {
        "acceptance": "cargo test",
        "isc_detection": "Run contract tests for OrderCreated",
        "dsd_conformance": "Check naming and control-flow conventions"
      },
      "human_check_needed": {
        "required": false,
        "reason": "",
        "resolved_at": null
      }
    },
    {
      "id": "L2-orders-002",
      "title": "Expose order creation API",
      "phase": "phase_1",
      "status": "pending",
      "author_agent": "Bebop",
      "layer": 2,
      "bounded_context": "orders",
      "target_loc": 300,
      "objective": "Expose the aggregate through an HTTP API.",
      "context_to_update": "project_state.md",
      "implementation_details": [
        "Add an HTTP endpoint under src/http.",
        "Use the existing order aggregate without widening domain scope.",
        "Cover the endpoint with tests under tests/http."
      ],
      "review_required": true,
      "attempts": 0,
      "micro_corrections_used": 0,
      "depends_on": [
        "L1-orders-001"
      ],
      "adjacent_scope_allowed": [],
      "write_set": [
        "src/http/**",
        "tests/http/**"
      ],
      "traces_to": {
        "prd": [
          "[FR-001]"
        ],
        "adr": [
          "ADR-0001"
        ],
        "ddd": [
          "OrderAggregate"
        ],
        "isc": [
          "[ISC-001]"
        ],
        "dsd": [
          "[DSD-001]"
        ]
      },
      "verification_steps": {
        "acceptance": "cargo test",
        "isc_detection": "Run contract tests for OrderCreated",
        "dsd_conformance": "Check naming and control-flow conventions"
      },
      "human_check_needed": {
        "required": false,
        "reason": "",
        "resolved_at": null
      }
    }
  ]
}
